{
  "actor": {
    "agent_id": "canon-inventory-sync"
  },
  "at": "2026-10-21T12:16:24.439953638Z",
  "case": "happy",
  "kind": "scenario",
  "project_id": "canon",
  "scenario_digest": "9bf8e66945a44ae416aac731429cb3bd30b16b11fd7c444a7adb518b3938d678",
  "scenario_id": "evidence.add.62",
  "schema": 1,
  "source_digest": "3d2b37d7da2d32a399bf6466b8dcca332a13ea6fac55f1bb62b7b5a1a7dde773",
  "subject_id": "evidence-attestation",
  "title": "Auto promotion commits every staged write and no-promote keeps one staged"
}