{
  "actor": {
    "agent_id": "canon-inventory-sync"
  },
  "at": "2026-10-26T17:02:56.058105627Z",
  "kind": "scenario",
  "project_id": "root",
  "scenario_digest": "d06387dbde4a4492ee535e6fae15638e02bc7b1a8c2ab86378fb8c4bb93d2bfd",
  "scenario_id": "auth.login.01",
  "schema": 1,
  "source_digest": "a04a948331511daabba9e20521ded3c34fe898b52b72c9678f1f6eee4b668f10",
  "title": "Case 01"
}