{
  "actor": {
    "agent_id": "canon-inventory-sync"
  },
  "at": "2026-10-21T12:51:47.803824603Z",
  "case": "failure",
  "kind": "scenario",
  "project_id": "canon",
  "scenario_digest": "7e2cb2da775dbae45473e1df71410f3866a69ae68e08883061ce63448fb97fa7",
  "scenario_id": "skills.install.10",
  "schema": 1,
  "source_digest": "7e460ee5b1d29fca4930fd860fdb915303b4efb96310b6b2bd4eeebd4fb9816d",
  "subject_id": "skills-install",
  "title": "A leftover legacy Codex projection is reported as a remnant with its fix, never deleted"
}