{
  "actor": {
    "agent_id": "canon-inventory-sync"
  },
  "at": "2026-10-21T11:40:32.581225497Z",
  "case": "happy",
  "kind": "scenario",
  "project_id": "canon",
  "scenario_digest": "3a6543fa3f0d181ba33ebab3f0b3503a48f506c2cbeafd924e428500096b6aff",
  "scenario_id": "evidence.add.93",
  "schema": 1,
  "source_digest": "ea01dc4b0d71836c4fb95d203a1ab016576179fa16297a6699394edd7838c662",
  "subject_id": "evidence-attestation",
  "title": "A batch binds each test's own attachments to that test's scenario and no other"
}