{
  "actor": {
    "agent_id": "canon-inventory-sync"
  },
  "at": "2026-10-21T12:16:24.427450155Z",
  "case": "happy",
  "kind": "scenario",
  "project_id": "canon",
  "scenario_digest": "c8aaacc15e62d40ab4bbceeffa111d5399d6beafe1345d17e7a3a9d390256e01",
  "scenario_id": "evidence.add.45",
  "schema": 1,
  "source_digest": "3d2b37d7da2d32a399bf6466b8dcca332a13ea6fac55f1bb62b7b5a1a7dde773",
  "subject_id": "evidence-attestation",
  "title": "An audit is recorded beside the declared verdict and never replaces it"
}