{
  "actor": {
    "agent_id": "canon-inventory-sync"
  },
  "at": "2026-10-18T14:54:57.290207602Z",
  "case": "failure",
  "kind": "scenario",
  "project_id": "canon",
  "scenario_digest": "e1a7ee28cd338e01bb83b1adf0b2ad3ddce8c36a9b414a5327c3285418fdd7f8",
  "scenario_id": "evidence.add.11",
  "schema": 1,
  "source_digest": "14cd32c99c08327f4af4c6aa44471fdc69b74ea8559ba3066c3495885bfe35bd",
  "subject_id": "evidence-attestation",
  "title": "A report binds the matched case and refuses a faithful claim over a failed case"
}