{
  "actor": {
    "agent_id": "canon-inventory-sync"
  },
  "at": "2026-10-21T11:40:32.116544820Z",
  "case": "failure",
  "kind": "scenario",
  "project_id": "canon",
  "scenario_digest": "2672f0925f4fee229b8458325ebae0ffadb1e4af58e314ecdcbe774ec4ffdf48",
  "scenario_id": "review.add.81",
  "schema": 1,
  "source_digest": "c6d5fb358d87950c0bb73ba4984bba92cc3d7fa58da61b0811a1f45c20c076ab",
  "subject_id": "review-attestation",
  "title": "A batch review with any scenario that has no record writes nothing"
}