{
  "actor": {
    "agent_id": "canon-inventory-sync"
  },
  "at": "2026-10-20T19:44:53.884168Z",
  "case": "failure",
  "kind": "scenario",
  "project_id": "canon",
  "scenario_digest": "b3d4e8a036c0a1766fb5fc980bb410402db629daac705882623e0f57be9c8691",
  "scenario_id": "gate.check.09",
  "schema": 1,
  "source_digest": "04459471e31a8212337be2cd2296e21be5d0c824af389b53a250f2e4a07b7858",
  "subject_id": "gate-trust-spine",
  "title": "A record whose own fields do not parse is malformed-evidence, not silence"
}