{
  "actor": {
    "agent_id": "canon-inventory-sync"
  },
  "at": "2026-10-21T11:40:32.020987206Z",
  "case": "failure",
  "kind": "scenario",
  "project_id": "canon",
  "scenario_digest": "7394aabf8c6b774388391aa425dc76bcfeb80d0dfb449acd62366c56574721bd",
  "scenario_id": "subject.lifecycle.17",
  "schema": 1,
  "source_digest": "3a4fdf955c883926fb05053f12b10f85ef5696f46c41c9e47fae5c3a7243c845",
  "subject_id": "subject-lifecycle",
  "title": "An override never waives the ship gate and a blank reason is refused"
}