{
  "actor": {
    "agent_id": "canon-inventory-sync"
  },
  "at": "2026-10-21T13:24:57.591662732Z",
  "case": "failure",
  "kind": "scenario",
  "project_id": "canon",
  "scenario_digest": "570bbfb804c173f91f56ae1d410ffa8466fdc273338d00b6430f47ebc57ea2c5",
  "scenario_id": "subject.lifecycle.28",
  "schema": 1,
  "source_digest": "13c4ecfa6a59954daa11711762312b076b1cb0c06d7aaa3615a61cc313e1c3bc",
  "subject_id": "subject-lifecycle",
  "title": "Shipping a change from an external plan needs its canon brief"
}