{
  "actor": {
    "agent_id": "canon-inventory-sync"
  },
  "at": "2026-10-18T14:54:57.306484726Z",
  "case": "failure",
  "kind": "scenario",
  "project_id": "canon",
  "scenario_digest": "903bb356a23d19d222ef9e83da0f8f82cb735989d3794e269ee0a31f62a3a1a5",
  "scenario_id": "evidence.add.20",
  "schema": 1,
  "source_digest": "14cd32c99c08327f4af4c6aa44471fdc69b74ea8559ba3066c3495885bfe35bd",
  "subject_id": "evidence-attestation",
  "title": "A session id outside the SessionId grammar is refused and nothing is written"
}