{
  "actor": {
    "agent_id": "canon-inventory-sync"
  },
  "at": "2026-10-21T12:16:24.506226076Z",
  "case": "edge",
  "kind": "scenario",
  "project_id": "canon",
  "scenario_digest": "e19a958ebf00fe307f432b29678c6b85b6a30ce322d6846c4d7cb0fea2adefc4",
  "scenario_id": "evidence.add.90",
  "schema": 1,
  "source_digest": "3d2b37d7da2d32a399bf6466b8dcca332a13ea6fac55f1bb62b7b5a1a7dde773",
  "subject_id": "evidence-attestation",
  "title": "A marker inside a path, a file name, a URL or a longer word is not a fabrication marker"
}