{
  "actor": {
    "agent_id": "canon-inventory-sync"
  },
  "at": "2026-10-20T19:44:53.846732Z",
  "case": "edge",
  "kind": "scenario",
  "project_id": "canon",
  "scenario_digest": "5f986aebd4ce5d938344d30e31f89679d9d3e76c84f16c689bc317a0346a9f89",
  "scenario_id": "gate.check.01",
  "schema": 1,
  "source_digest": "04459471e31a8212337be2cd2296e21be5d0c824af389b53a250f2e4a07b7858",
  "subject_id": "gate-trust-spine",
  "title": "A repository with nothing to complain about gates green"
}