{
  "actor": {
    "agent_id": "canon-inventory-sync"
  },
  "at": "2026-10-21T12:16:24.466214008Z",
  "case": "edge",
  "kind": "scenario",
  "project_id": "canon",
  "scenario_digest": "e344cc0dac9b7463d32de11c44bd80255e23bc3e1ec356632a53da7d615dd7c9",
  "scenario_id": "evidence.add.69",
  "schema": 1,
  "source_digest": "3d2b37d7da2d32a399bf6466b8dcca332a13ea6fac55f1bb62b7b5a1a7dde773",
  "subject_id": "evidence-attestation",
  "title": "A subject with no brief to answer is attested as before"
}